{
	"$schema": "../../company.schema.json",
	"name": "CrowdSec",
	"url": "https://crowdsec.net/",
	"at": "jobs",
	"building": "collaborative security engine",
	"products": [
		{
			"name": "CrowdSec Security Engine",
			"url": "https://crowdsec.net/"
		},
		{
			"name": "CrowdSec Console",
			"url": "https://crowdsec.net/"
		}
	],
	"socials": ["https://github.com/crowdsecurity"],
	"offices": ["paris", "nantes"],
	"headcount": 70,
	"founded": 2019,
	"jobs": [
		{
			"position": "data-engineer",
			"category": "data",
			"level": "senior",
			"type": "full-time",
			"tech": ["python", "apache-kafka", "go"],
			"url": "https://crowdsec.net/careers/data-engineer"
		}
	],
	"updated": "2026-09-16T14:00:00.000Z"
}
