{
	"$schema": "../../company.schema.json",
	"name": "Zama",
	"url": "https://zama.org/",
	"at": "jobs",
	"building": "fully homomorphic encryption tools",
	"products": [
		{
			"name": "Concrete",
			"url": "https://zama.org/"
		},
		{
			"name": "TFHE-rs",
			"url": "https://zama.org/"
		},
		{
			"name": "fhEVM",
			"url": "https://zama.org/"
		}
	],
	"socials": ["https://github.com/zama-ai", "https://x.com/zama"],
	"offices": ["paris", "remote"],
	"headcount": 90,
	"founded": 2020,
	"jobs": [
		{
			"position": "blockchain-security-engineer",
			"category": "security",
			"level": "any",
			"type": "full-time",
			"tech": ["ethereum", "go"],
			"url": "https://zama.org/careers/blockchain-security-engineer"
		}
	],
	"updated": "2026-09-16T17:00:00.000Z"
}
