{
	"$schema": "../../company.schema.json",
	"name": "Comma",
	"url": "https://comma.ai/",
	"at": "jobs",
	"building": "open-source driver assistance",
	"products": [
		{
			"name": "openpilot",
			"url": "https://comma.ai/"
		},
		{
			"name": "comma 3X",
			"url": "https://comma.ai/"
		}
	],
	"socials": ["https://github.com/commaai", "https://x.com/comma_ai"],
	"offices": ["san-diego"],
	"headcount": 30,
	"founded": 2015,
	"jobs": [
		{
			"position": "software-engineer",
			"category": "systems",
			"level": "senior",
			"type": "full-time",
			"tech": ["python", "c", "cpp", "rust"],
			"url": "https://comma.ai/careers/software-engineer"
		}
	],
	"updated": "2026-09-16T16:00:00.000Z"
}
