{
	"$schema": "../../company.schema.json",
	"name": "Windmill Labs",
	"url": "https://windmill.dev/",
	"at": "jobs",
	"building": "developer platform for internal tools",
	"products": [
		{
			"name": "Windmill",
			"url": "https://windmill.dev/"
		}
	],
	"socials": ["https://github.com/windmill-labs"],
	"offices": ["paris", "remote"],
	"headcount": 12,
	"founded": 2022,
	"jobs": [
		{
			"position": "rust-engineer",
			"category": "backend",
			"level": "any",
			"type": "full-time",
			"salary": {
				"amount": [70000, 120000],
				"range": "yearly",
				"currency": "eur"
			},
			"equity": [0.1, 0.5],
			"tech": ["rust", "python", "svelte"],
			"url": "https://windmill.dev/careers/rust-engineer"
		}
	],
	"updated": "2026-09-18T05:00:00.000Z"
}
