{
	"$schema": "../../company.schema.json",
	"name": "Upbound",
	"url": "https://upbound.io/",
	"at": "jobs",
	"building": "cloud-native control planes",
	"products": [
		{
			"name": "Crossplane",
			"url": "https://upbound.io/"
		},
		{
			"name": "Upbound Cloud",
			"url": "https://upbound.io/"
		}
	],
	"socials": ["https://github.com/upbound", "https://x.com/upbound_io"],
	"offices": ["seattle", "remote"],
	"headcount": 100,
	"founded": 2017,
	"jobs": [
		{
			"position": "software-engineer",
			"category": "backend",
			"level": "senior",
			"type": "full-time",
			"tech": ["kubernetes", "go"],
			"url": "https://upbound.io/careers/software-engineer"
		}
	],
	"updated": "2026-09-17T03:00:00.000Z"
}
