{
	"$schema": "../../company.schema.json",
	"name": "Coder",
	"url": "https://coder.com/",
	"at": "jobs",
	"building": "self-hosted cloud development environments",
	"products": [
		{
			"name": "Coder",
			"url": "https://coder.com/"
		},
		{
			"name": "code-server",
			"url": "https://coder.com/"
		}
	],
	"socials": ["https://github.com/coder", "https://x.com/coderhq"],
	"offices": ["austin", "remote"],
	"headcount": 100,
	"founded": 2017,
	"jobs": [
		{
			"position": "software-engineer",
			"category": "systems",
			"level": "senior",
			"type": "full-time",
			"salary": {
				"amount": [150000, 200000],
				"range": "yearly",
				"currency": "usd"
			},
			"tech": ["c", "cpp", "go"],
			"url": "https://coder.com/careers/software-engineer"
		}
	],
	"updated": "2026-09-17T17:00:00.000Z"
}
