{
	"$schema": "../../company.schema.json",
	"name": "Flow",
	"url": "https://flow.com/",
	"at": "jobs",
	"building": "blockchain for consumer apps",
	"products": [
		{
			"name": "Flow",
			"url": "https://flow.com/"
		},
		{
			"name": "Cadence",
			"url": "https://flow.com/"
		}
	],
	"socials": ["https://github.com/onflow", "https://x.com/flow_blockchain"],
	"offices": ["vancouver", "remote"],
	"headcount": 150,
	"founded": 2018,
	"jobs": [
		{
			"position": "compiler-engineer",
			"category": "systems",
			"level": "senior",
			"type": "full-time",
			"tech": ["python", "c", "cpp", "go"],
			"url": "https://flow.com/careers/compiler-engineer"
		}
	],
	"updated": "2026-09-17T00:00:00.000Z"
}
